post_id,Post_text,Post_text_tokens_size,Assigned_Bucket,Post_Text_Zs_clf,TLDR,TLDR_tokens_size,TLDR_Zs_clf,AI_Summary,AI_Summary_tokens_size,AI_Summary_Zs_clf,Post_Text_Human_Inspired_Zs_clf,TLDR_Human_Inspired_Zs_clf,AI_Summary_Human_Inspired_Zs_clf,True_label
7d2iyo,"I've talked to a couple people about him and even googled how he's acted that he's emotionally and verbally abusive...  I'm also starting to think he falls more into the category of narcissistic abuse now that I've started reading up about it... at the same time I find myself second guessing myself and that maybe it's not that bad since he doesn't hit me and I have zero evidence of how he is because he's only mean when no ones around but nice to everyone else... it just makes me feel like I'm a crazy person and that I'm just complaining since he doesn't hit me... but I also feel so insecure and unsure of anything I say or do. I'm constantly anxious trying to do whatever I can to not upset him or cause him to yell at me or insult me... even though regardless of what I do, I still end up doing or saying the wrong thing.

He makes me feel so unattractive and worthless and like he's doing me a favor by being with me, and that I could never survive on my own without him. He acts proud to be with me around others, but behind closed doors, he picks at my worst insecurities and makes me feel terrible. I'll call him out on his behavior or try to stand up for myself, and then he'll either get mad and give me the silent treatment and not apologize, or he'll tell me I'm lying and that he didn't do or say something. Even though I know he did. He criticizes my parenting and tells me I'm lazy since I'm a SAHM (even though I do all the cleaning, cooking, taking care of our toddler, taking care of our pets and anything else around the house with little help from him because he feels entitled to not do anything since he works and I don't). 

To top it all off, he doesn't think he has a drinking problem... yet always drinks at least 3 beers or more every night. He also slapped my son and left a mark on his face while we were camping (I didn't see him do it because I went to go pee but saw it and asked about it when I got back). 

I'm scared to leave him because on more than one occasion he's threatened to get custody of our son or told me to leave if I wanted to break up, but to leave our son with him. I feel so pathetic because I feel scared of someone who doesn't even hit me... like is anything I'm saying justifiable reasons to leave him?",514,Q2,1,Ranting and second guessing myself regarding my emotionally abusive fiancé,13,1,"The person is in a emotionally and verbally abusive relationship, with signs of narcissistic abuse. They feel insecure and anxious, constantly trying to avoid upsetting their partner. The partner criticizes their parenting and is dismissive of their feelings. They also have a drinking problem and have been physically abusive towards the child. The person is scared to leave because of threats regarding custody of their son.""",76,1,1,1,1,1
6wsawa,"It's hard for me to even type this, but today I dropped my classes after only a week of school. I've been in school for a while, just got my associate's degree in liberal arts at a community college and was planning on going to university for an English degree. I will note that the majority of my classes were online as I can't focus in an in-person class due to my social anxiety. However, I panicked about my future and how English isn't a ""lucrative"" field and changed gears. 

I enrolled in a program that was for Physical Therapy Assisting. I thought it sounded nice to help people and I was interested in healthcare, while not fully invested in it. Plus apparently it is a growing field etc. etc. Well, I went to class my first week and was terrified. The program is extremely competitive and intense. I felt like I didn't have enough emotional investment to continue. I did gather the courage to complete one of my 8 hour volunteer sessions at a physical therapy facility. My anxiety skyrocketed because I was constantly interacting with people and the therapists, while nice people, were confident, blunt, and extroverted which intimidated me.

Today, I dropped my classes. I want to study English. The sad thing is I want to study English because it feels safe. I'm feeling so defeated and  weak and am wondering if I made the right decision or if I just screwed up my life. I was so enthusiastic about this new program, I told my family and friends and now I have to tell them I changed my mind, again....",324,Q2,1,I dropped my PTA classes and am going to maybe study English now because I was intimidated. Feel like I screwed up my life.,27,1,"The person dropped their classes after only a week of school, feeling overwhelmed by the pressure and competitiveness of a new program in Physical Therapy Assisting. They had initially chosen this program due to concerns about the financial stability of an English degree, but ultimately realized their passion lies in studying English. They are feeling defeated and unsure if they made the right decision.""",70,1,1,1,1,1
7bo8f2,"I'll try not to make this too long [spoiler: I failed lol].  I disconnected all contact from my abuser over a year ago. Now, lately he has created accounts under false names, pretending to be someone who knows my ex ""very well"" and sends me messages and whatnot, telling me what ""my ex is saying about me""

Before you go all ""block him!"" ""call the cops!"" ""ignore him!"" etc., etc., I have - he keeps making new accounts on stuff and the cops can't prove it's actually him contacting me - also there's no name of this Stranger who is talking to me. I am ignoring him, that's not what this post is about.

Basically, after all this time my ex has recently, decided he ""knows"" I cheated on him our entire relationship [I didn't], ""knows"" I'm this chick online who post XXX pictures of herself [I'm not] and has ""reminded"" me of incidences of our relationship that has literally never happened. Like, for one example *""...that time I called you from jail, and you cried b/c you were at a guys house and you knew what you did was wrong so you told me you needed help...""* yet he won't show me any evidence (it doesn't exist)...

He's literally fabricating things out of thin air and claiming they happened. He isn't denying that he was an abuser, but he's saying like ""You were bad too! You did this and this and that..."" even tho, I did none of the things he's accusing me of. 

Is this a form of gaslighting? That's all this post is for; is to see if there's a name for this type of odd behavior. I'm not looking for advise on what to do about it. I don't care about what he's saying, or whether he believes his lies - I'm simply wondering if there's a term for this sort of thing.

Thanks.",411,Q2,1,A year after I left him. My ex abuser is literally fabricating things out of thin air and claiming they happened when we were together - what is this behavior called??,35,1,"The poster has been disconnected from their abuser for over a year, but the abuser has been creating fake accounts to contact them and spread false information. The abuser is fabricating events and accusing the poster of things they didn't do. The poster is asking if this behavior is a form of gaslighting and if there's a term for it.""",72,1,1,1,1,1
7rex1a,"I have a coworker that started working the same position I'm working probably 6 months after me. After another six months, she is not proficient in her job duties. She doesn't listen (makes the same mistakes over again), extremely defensive/argumentative, and passive-aggressive... She's also extremely sensitive/lacks confidence and thinks that everyone thinks that she's incapable of doing the work (which is true). She will argue with me on nearly everything I ask her to do. She's loud, obnoxious, and lacks common sense. 
  
Our job performance is mostly based on production so the more work that gets done the better. She is very slow and I end up doing most of the work. She gets extremely upset that I don't leave her enough of a certain task, but there's plenty more tasks to complete. Everything gets a ""time credit"" and she is more concerned about the credit than actually getting work done. For example, 1 phone call equals 5 minutes of time credits and if you're spending 10-15 minutes on it, your production percentage will drop. If she does the easy work then her percentage will increase. 
  
I have told the boss all of this but she hasn't been fired yet. I am not sure how to deal with her. Every day I am in rage mode listening to her pure stupidity and trying to argue stupid things. I'm on the verge of absolutely blowing up on her but I would lose my job. Please give advice on how to deal with an extremely difficult coworker before I absolutely lose it!!!",317,Q2,1,crazy coworker is affecting my work.,9,1,"The post describes a frustrating situation with a coworker who is incompetent, argumentative, and unproductive. The poster is seeking advice on how to deal with the difficult coworker before losing their temper.""",40,1,1,0,1,1
7t9m12,"I want to post this on a throwaway but I won't. I really don't know what to do right now, and I'm just stewing in my own anxiety without a way to get anywhere. I don't know how to talk to my friends or family about this yet.

My partner and I have been living together since September. I moved to a different state to be with him. I moved into his home and started going to school. The entire transition has been awful. The stress of changing that many things in my life at once has been beyond difficult. I found a new therapist today which should be helpful. I don't have any friends in this city, and it's just too hard for me right now to sum this up on a phone call. I'm also embarrassed, and I feel so stuck.

My partner is a (former?) heroin addict. I've known this from the beginning, but I assumed it had been awhile since he told me so. No need to dig up his past; I was also a drug user. Things were fine when I first moved in. We were both pretty busy. He's working on his second master's at a very good school and has a pretty serious job, but he's new to it. The long hours working on an international team for a venture capital firm has to take its toll while studying at a prestigious school. He was still himself though.

The past two months have been gut-wrenching watching him transform. Our holiday break was going okay, but it's where I started to get suspicious. He had gotten a few Xanax for us to use on the plane/during the stress of it all. I took 1/4 of one when my anxiety spiked very bad (because of him). He acted so strange, and it was prime time to use because we were going to our hometown where it would be much easier for him to score.

We have had a single meal together in the past month, and we've had sex once. He didn't even get off. Red flags abound... sneaky texts to numbers that aren't saved in his phone, a razor blade with white powder on his desk that I tasted (tastes like a fucking opioid, obviously). I found pills in his car. I found needles in his Amazon history. I found emails to dealers on Craigslist. He has all these receipts from the same McDonald's 1.5 hours away from us, and on the entire other side of the bay from where he normally works. There is no reason he would be a regular there? There are ripped off Q-tips in his car. He threw up in his car trash can. He nearly passed out the other night after having a serious cold spell, passed it off as a random seizure (why the fuck would he have a seizure?). He is up for 2-4 nights in a row without a lick of sleep. He's lost weight and he's pale. He hardly eats real food despite me cooking it - just junk food. I AM NOT THE KIND OF PERSON WHO GOES THROUGH INBOXES AND TRASH CANS. Why is this my life?!

He told me he sold the pills back. He told me he threw the needles out and never used them. Every story doesn't add up. There are so many holes and no evidence to prove his rebuttal(s). I'm so devastated. I am so hurt. My parents were addicts. My exes were addicts. It's not the drugs or the behavior. It's feeling like I'm not worthy of the truth. I found drugs as a child all the time, my parents sweeping my discoveries under the rug as though they weren't *drugs.* They were! That's how I started using them! 

This man is so thoughtful, kind, patient, and understanding. He's the most intelligent person I've ever met. I've learned so much about the world and about what it means to be human from him. Addicts are not bad people, but they are bad liars. I've lost two of my best friends to heroin and my father to addiction. I made it out alive a long time ago, and I want nothing to do with this anymore.

After writing this out, I realize the evidence I have is so strong and the consensus is probably clear. I just don't understand why I can't get the truth from him.

I'm in school full-time and he's been mostly supporting me financially besides my financial aid. I just started this quarter, and as much as I absolutely hate being in school, it would be awful to drop out because of this. I can't afford to live anywhere around this area by myself! I have friends in different cities around the state who would gladly help me which is keeping me sane. I hate not having any support in real life here. I spend all day on the verge of tears lately. I miss being myself.

I have given him an ultimatum. I would like concrete proof that he hasn't been using (whatever the fuck that is), or I would like the truth so we can communicate effectively, so I can support him in whatever he is going through, and so that we can heal. Is there anything else I can do? I'm not going crazy, right? Yes - I've been actively looking for this stuff, but there is no way this was a one-off, ""bought some pills on a bad night and regretted it"" incident. The evidence is there, and it is only growing stronger.

I have no car and no money. He told me he'd help me start over if I decided to leave. I just don't know what to do. My mental health has been SO poor lately because my workload sucks, my commute is long, and I have no means of transportation in a small town. I can't take much more. I hate being unworthy of the truth and feeling like I'm crazy for thinking this. This feels like my entire life, with everyone I've ever expected to love and care for me. I'm fucking over it.",1236,Q3,1,"I know my boyfriend is probably on drugs, or at least was actively using for some period of time recently, and you will probably agree with me if you read the evidence. What do I do? I just need someone to talk to and some sound advice.",52,1,"The author is in a difficult situation, living with a partner who is showing signs of drug use. They feel stuck and isolated, with no support in their current city. They have confronted their partner and given an ultimatum, but are struggling with their mental health and lack of resources. They are considering leaving but feel trapped due to financial dependence and lack of options.""",74,1,1,1,1,1
85stwn,"I missed the primary elections two years ago because two years ago yesterday, my ex dislocated my arm in three places in the wee hours of the morning and threw my car/house keys into his lawn in the dark and rain. I was still trying to get it back together because I couldn't explain it at the ER and I didn't want insurance make me have to face him in court. I should have seen it coming. Three months before that, he screamed in my face and grabbed me by the shoulders. I ignored the blazing red flags. I still experience daily pain. Roughly twelve hours before that he'd shoved me over the couch (I have a serious back injury which I finally had my spine fused for recently, and that has long been a huge no no for me) and yanked my pants down to try to fuck me while his 4 y.o. daughter was in the bathroom. He was angry he didn't succeed because she finished using the bathroom too quickly. I was shocked because he hadn't done anything like that in the 11.5 months we'd been together, but as a testament to my prior experiences with abuse, I saw it as nothing terribly abnormal. This was what I'd always known relationships to be, whether it be family, friends, or intimate relationships.

I was supposed to move in with them in a couple weeks. I wanted to wait until a year in, because I knew deep down he was a bad guy, but I wanted to be wrong. I wanted to be a mom (I can't have kids), and I wanted to save his daughter from the life I had growing up. He used this all against me. He's a narcissist and has some severely anti-social tendencies. 

Last night I had a nightmare involving me babysitting for him and his ex-wife, and their friends drugging me to rape me when they brought the party home. It brought back all the bad and my husband (we met two years ago next month) has super-hearing abilities and heard me crying while he was in the bathroom getting ready for work. He came out to hold me. Now he's gone and I'm crying again, damn it. It brought back all the memories of all the physical and sexual assaults and rapes I've experienced. People like that can smell a victim a mile away. 

The shame is so overwhelming right now. That I let it happen. My entire life. From the first time I didn't say anything aged six. I just want to forget. I don't want to feel these people touching me. So many people, so many times, I've literally lost count. The things I've let happen because I never understood that people who love you don't hurt you like that. Things I let happen because I was conditioned to believe from such a young age that that is what life is. Hiding, hurting, and being used. Because I never saw the value in myself as a person. I still don't. I'm a garbage person. 

My husband was the first to tell me that it wasn't normal to let myself be an object. A fuck toy and a punching bag. I had just accepted my fate that it was my place to be used and abused. That my normal was to live in fear of being hurt or fucked. I was 34 when we met. Now, after all the years of being used like a Kleenex, I feel so dirty, ashamed, and undeserving of someone as wonderful as he is. I feel like if he truly knew all that had happened, all the things I let happen, though I've shared a lot with him, that he would be disgusted. He's a better person than that, I know. But I feel unworthy of love, and unworthy of the safety I have with him now. This morning I told him I often wonder if I'd met him sooner, if I'd believe him or just brush him off as some bullshit fairytale who would eventually hurt me in the same ways. It did take a long time after we got together to believe he wouldn't, but now I actually believe he'd lay down his life to protect me. And I don't think I deserve that.

I'm just so sad and filled with so much self-loathing today. The memories literally make me sick, make me vomit, which I don't need to be doing right now after a major surgery. I just want to erase it all. A couple months ago I asked my psychiatrist if ECT would make me forget. Apparently it doesn't work that way. I don't drink or do drugs anymore (which didn't help keep me safe at all btw) so there is nothing to blur it out. I just have to live with all the horror and memories and I hate it.",976,Q3,1,I hate myself and the life I led. I'm ashamed I didn't figure out that things could be different sooner.,24,1,"The post describes a history of physical and sexual abuse, as well as feelings of shame, self-loathing, and unworthiness. The author shares experiences of being used and abused, and expresses a desire to forget the memories. They also discuss their current relationship and feelings of unworthiness of love and safety.""",63,1,1,1,1,1
7pd36r,"We've been together for over 5 months now. It's been the happiest 5 months, being in a relationship, of my life. This is his first relationship, so we've gone through some small bumps. I feel that the biggest problem we have now, is that he wants this ""perfect relationship""  I can't give that.

He defines a perfect relationship as a relationship where both people can give and take each others firsts (first time). I feel that this is a lot to ask for, and when I expressed my feelings he would become upset, saying things such as ""well I'm sorry I want something like this"". Those kinds of hostile things, and I honestly don't know how to reply to something like that. I mean, what can I do? I don't see any way I could do anything about it.

A few days ago he asked me to tell me the things I've done in my past relationships. I personally felt a bit uncomfortable with this topic, as it is something that is difficult for me to open up about, but I told him anyway.

He didn't take it very well  and maybe it's too much for me to ask, but the least he could've done was shown any sort of support for my opening up to something so huge.

After I told him, he became livid. Said that he regretted not meeting me earlier (before I dated my ex)...I didn't know how to react.
Later on that night he starts saying that he ""doesn't know if he wants this (relationship) anymore"". Being the type of person I am, I apologize for upsetting him. I begin to push for us to talk it through, because I felt that it was something we could get through if only we talked. For hours he kept giving me short responses, constantly telling me ""I don't know"". This continues for another three days.
No matter what I say, or do, I feel hopeless. I feel like at this point, I'm the only one putting effort into our relationship. I've suggested taking time to ourselves so that he could think things through, taking a break, talking about it, meeting up (we really only can see each other on the weekends due to classes), etc. Still, the short responses.
He's started to not respond to me; we talk through an app that shows when the other has read the message. I know his class schedule, so I know when we can answer back (he checks his phone often). It's just frustrating to me that he really should, but does not answer back to me  and when he does it's short responses. I could send something really long, but it doesn't seem like he cares at this point.
He'll constantly tell me that he's ""trying his best"", but I honestly don't feel that his ""best"" really is. I don't feel any effort coming from his side.

Maybe it's too early to tell what I should do, but it's been really stressful and hard for me. I feel that he's asking for too much, and I'm starting wondering if he really loves me for me(and that's why he hasn't left yet) or if he just really wants this ""perfect relationship"".
He knows that I can't give it to him and it's just not gonna happen. He doesn't know if he'll ever get over this, as it is something he's wanted for a very long time. I don't know how to feel or what to do. I feel like I've tried my hardest, but I'm not getting the same feeling back from him. I really love him, from the depths of my heart, and it hurts me when he says things like this. I feel terrible for not opening up to him earlier, but at the same time I feel like it was such a huge thing for me to do so I'm very conflicted. What are your opinions? What should I do? Is it really too much or am I just being selfish? Is there anything I should ask/try?

I know this is really long, but if you've read up to here thank you. It means a lot. I probably sound like a big baby, but this has really given me a lot of stress.",867,Q3,1,"Boyfriend wants, what seems to be, an unrealistic relationship. What should I do?",18,1,"The poster has been in a happy relationship for over 5 months, but their partner wants a 'perfect relationship' and becomes upset when they can't provide it. The partner also reacts poorly to the poster's past relationships and is now considering ending the relationship. The poster feels they have tried their best but is not getting the same effort in return, and is unsure of what to do next.""",79,1,1,0,1,1
