post_id,Post_text,Post_text_tokens_size,Assigned_Bucket,Post_Text_Zs_clf,TLDR,TLDR_tokens_size,TLDR_Zs_clf,AI_Summary,AI_Summary_tokens_size,AI_Summary_Zs_clf,Post_Text_Human_Inspired_Zs_clf,TLDR_Human_Inspired_Zs_clf,AI_Summary_Human_Inspired_Zs_clf,True_label
7rb9t6,"I realize this is a lot of information. I'm heartbroken and rambling. I've never loved someone so much before and I don't know what to do with myself right now, so any advice will help.

Some general background: I started dating one of my best friends four months ago. We had been good friends for three years but both dated other people. Though we both had crushes on each other we weren't sure if the feelings were reciprocated. She also has some self esteem issues and told me that she wasn't ready to date someone like me three years ago when we first met, because I was ""too intimidating"", but instead ""settled"" for her ex. She dated that ex for two years, but never seemed that interested in him. She would complain about feeling like a caregiver for him (he was seriously depressed to the point where she had to make doctor appointments for him) and always talked about wanting to be with someone who was more independent and had their life together. As her friend I remember her saying she felt like he was good for her at the moment, but that she knew it wouldn't last forever (side note: she was open about her feelings with him, and he agreed to just enjoy things in the moment, though I'm sure he was secretly hopeful she would change her mind).

After they broke up, we grew even closer. She confessed that she wishes she hadn't let things drag on with her ex. We talked a lot, until 6 months after their break up (and a few bad rebound dates for her) she told me she had feelings for me. I told her they were reciprocated and we started dating. The first few months of the relationship were the best months of my entire life.

My issuse: The relationship was great until I started experience serious anxiety. I was hit with unexpected financial difficulties last month, and am still at risk of having to drop out of school and move in with my parents while I work off some debt (I only have two classes left but am having serious issues with student loans right now). I have been an anxious mess since this started happening. Even though my girlfriend and I had only been dating for three months at this point I started using her as an emotional crutch since we had been friends for three years. I would text her in a panic while she was at work whenever I had an appointment with the school or the bank. I was caught up in my own issues. I thought that because she loved me she'd be there for me no matter what.

The break: She told me a week ago that she feels like something is missing from our relationship. She said the idea of spending time with me just stresses her out, instead of exciting her like it used to. I realized right away why that was (I had been so on edge from all of the stress that my friends said hanging out with me felt like a ticking time bomb) and apologized. Before I knew I was going to lose her, I genuinely regretted using her as an emotional dumping ground. She's so amazing and deserved so much more than that. She accepted my apology but said she was still feeling anxious and unsure, so we agreed to take a break and go on a date next month to ""start fresh"". As we were leaving/the conversation was ending, she was very flirtatious and joked with me that the next four weeks would be like extended foreplay.

Her issues: During that conversation she also disclosed some of her own issues & trauma. She said that past experiences from childhood make it hard for her to be physically affectionate with someone, and that she can't be the girlfriend I need right now because all she wants is physical space, while all I want is to cuddle and have physical affection. Though I believe her, I'm very confused why issues from her childhood trauma are coming up now but didn't come up when she was dating her ex of two years. 

The break-up: After not seeing each other for a week I asked her to go to lunch because I was really confused about what was happening between us. She had been kind of flakey with answering messages at times, but at other times would blow up my phone. I had a weird feeling about everything and just wanted to talk. She basically said that whenever she's around me she feels anxious, and even though I ""check off all of her boxes"", she loves me, and she can see herself marrying me one day, she can't be with me right now. She said she really wants to be friends and ideally would want to try dating again in a few months (maybe once I'm graduated and things are settled down) but that she needs more time than one month and isn't sure when she'll be ready. She said she needs work on her own mental health/anxiety. She told me that she won't ask me to wait for her, because it's not fair to me. I tried to be understanding, and we ended up just chatting and joking around after the break-up.

As we were leaving the restaurant she made a small comment about me going on Tinder. I told her I didn't have to go on Tinder, and reminded her that she was the one ending things. She got awkward, and said she was ""just joking to deal with the jealousy"". I told her I didn't mind waiting for her and she told me not to wait. She said she wanted me to be happy, even if that meant seeing someone else, but that she just hopes we can be friends.

Once we were apart she sent me some snapchats but I didn't answer. I haven't heard from her since.

I'm completely broken over this. She was my first love, and I'm convinced I'll never find someone as perfect for me as her. Her friendship played a huge role in my life for three years, and I honestly feel like I've lost the best part of my life. I want her back more than anything in the world right now, even though the rational part of me is saying I need to move on in order to avoid being hurt. I just keep holding onto the fact that she can see a future with me and wants to date me in the future...

Any advice is appreciated.",1270,Q3,1,"My friend of three years (but girlfriend of only four months) told me she can see us working out someday, but ""not right now"". I'm absolutely devastated and don't know what do. I've never been so hurt in my entire life. Pleas help.",55,1,"The poster is heartbroken and seeking advice after their first love, who was also their best friend, ended their relationship. The breakup was due to the poster's anxiety issues and their partner's own mental health struggles. The partner wants to remain friends and potentially try dating again in the future, but the poster is struggling to move on and is holding onto hope for a reconciliation.""",75,1,1,1,1,0
7p945u,"Long story short. I met my girlfriend on OKCupid. We are still together for what is now 7 months. Summer was great. I didn't want it to end. Sex was amazing, every moment was amazing. We made it official in August. We expressed our love for one another fast. It was amazing. We already had so many. September rolls around and she is on her way to attend an Academy to be a Court Officer. In preparation, I take her everywhere she needs. What they asked of her is ridiculous. I did it because at this point I know I love this girl. She loves me, communication is there. She asks me to drive her the school. She needed me. I said yes. It was a stretch of 4 months, 4 trips a week, 2 days Friday and Sunday going and coming. It was hard on me. I let her know it but I also let her know I do it because I love her. She seemed to have an issue with me expressing myself.
With stress from the school directly into the job itself she became distant. Less and less texting, feeling no need to communicate, moments of depression which she suffers from, low self esteem, her mom becoming ill and needing hip replacement at age 74 and not doing well following the surgery. We got into an argument over it because what once was, isn't anymore. I asked if there was another guy, attraction issues. No. She tells me she is in love with me but sees no future with me. This comment blew my mind. It's illogical. I felt it was said in anger. She reached out to me the very next day because I felt she knew what she said was wrong. Following the fight, we see each other for dinner that same weekend. Things are normal. Christmas comes, she spends time with her mom after surgery, I understood, things were normal. We love each other. Cuddling, kissing, hugging. 

New Years comes, I check on her and her mom. Ask if she needs anything after being up all night...she snaps on me for things I said in December. She don't want me to do anything because what i said about the driving taking a toll on me hurt her. She said she didn't like that I expressed I go above and beyond for her. She found that to be tacky and pathetic. I didn't mean it that way, I was just worried about having some level of appreciation which I was not feeling. I don't see her for New Years. She ignores me without texting me at midnight. I hear from her the following night and she told me she is in her own world. She proceeded to ignore me the next 4 days. Got in touch with me last Friday. Asked about me and my parents. Told me about work and her mom. How stressed, tired and overwhelmed she is. Again she expresses how she doesn't want to talk to anyone. Its literally go top work, straight to her mom, home to sleep and all over again all week. Spends all her time doing laundry and sleeping and time with her mom on the weekend. I tell her I was worried, and right back to ignoring again right to today. I haven't heard back from Friday BUT I see her liking BUT not commenting on Facebook posts. She has her phone on her, She is on social media but can't text me back? I decided to write her a beautiful card expressing how the distance is killing me and how I want nothing more than to be apart of her world. My heart is dying to reach out. I sit here feeling used, forgotten and abandoned. She doesn't let me know what she needs or wants and I am here thinking the worst. Someone please help me with some advice...I want to believe she is just going thru a difficult time right now because honestly...I knew this was the girl I wanted to keep in my life",801,Q3,1,"MY GIRLFRIEND AFTER 7 MONTHS OF FULL LOVING SUPPORT FROM ME HAS DISAPPEARED AND IT HAS LEFT ME IN TEARS




tldr Why would she do this after everything I did for her and have have the courtesy of letting me know? Is the stress of the job and her mothers illness that bad? Wouldn't she have broken up with me already if she wanted to?",81,1,"A man met his girlfriend on OKCupid and they had a great summer together. However, she became distant and stressed after starting an Academy for a Court Officer. She expressed doubts about their future and has been ignoring him, causing him to feel used and abandoned. He is seeking advice on how to handle the situation.""",64,1,1,1,1,1
7omiu8,"Okay so this is my first post on any forum, any discussion, any anything. I need help.

Background info - sorry it's so long:

I've been with my boyfriend for 3 years. The first year was a really rocky time, we met working together in a bar and through the process of figuring out we lived close, started to see each other outside of work. I had a close male friend who I stupidly introduced him to as my 'brother' when they first met because I was an idiot. Male friend then stayed over as we had been doing with each other for years before. My boyfriend (we had only just started to see each other at this point) flipped when he found out we were not related and was convinced we slept together which we did not. I then proceeded to cut all ties with my friend because that was what he wanted.

Few months later, my best best friend was having her birthday party in our bar. Me and my boyfriend had argued that day, so he was pissed. He treated my friends badly all evening. She then - without my knowledge - wrote a huge complaint about him to our managers. He then lost his promotion because of that. Me and my best friend fell out. We didn't speak for a while - all my fault through being weak - until her wedding that autumn at which I was one of her bridesmaids. The weekend before, my boyfriend had been at my place and my best friends fiancé was there, drunk. He said a few drunken things and my boyfriend punched him in the neck. We agreed to not tell my friend until after the wedding. The wedding for me was horrendous with many of my previous best friends in the know. When my best friend found out after, she called me in a rage - understandably - and we didn't speak again for a long time.

I was weak. We were still working together and I got back with this guy. My friends kicked me out of my house and we moved in together - because he was having a few issues with his landlord it was a move for convenience rather than for love.

I cut all ties with all of my precious friends for him because he felt betrayed if I would speak to them. My best friend tried a few times to make up but I ignored her. I ignored her. I ignored her completely for him.

We've lived together 2 years now. We've had countless fights. I feel like I'm always to blame. Nothing is good enough. But at the same time he opened up to me and I saw all his sides, his weaknesses and his loyalties and his fun and his charisma and his passion for life. But we stopped going out. We never went out on dates or anything. His reason was that he would rather save money and stay home where he can smoke than pay for any expensive experiences. I managed to convince him to go on holiday with me for a week but he's always thrown it back in my face that he would rather have gone home (he's Spanish), saved the money, got a new tattoo etc.

Now. I love to paint but I have in my life had a complete lack of motivation or energy. I started doing an evening course which I loved. I started to think about what I want to do in my life. I started to think about living abroad a little time, experiencing something new. I'm sick of London. My job is fast becoming a battleground between managers and staff. I want something different. I want to travel and get away for a while.

My boyfriend lost his job at that bar. He was fired. He then got another job in a different bar and was fired. He then didn't work for 6 months, spent all his money. He then got a builders card (he had been a builder in Spain) and started looking for work. He hasn't had much luck. He's in a dire financial situation.

I'm not happy with my life right now. I've found a few amazing looking art courses in Madrid and because I've been going to Spain every year my life and can speak a very little Spanish, I feel like this is something I now have my heart set on. I can learn a language! I can travel! I can leave London.

I told him. He didn't take it well. He was hurt, he was upset, he was angry. He feels like I'm choosing art over him. He feels like it's a stupid idea, with no career potential, and I'm throwing my life away and I've wasted the 3 years we've been together. He's begged me not to go. He feels so alone. And I feel so so so guilty for wanting to leave for a new experience when he has no friends, no job, no money. He says I'm being selfish. I feel selfish but I cant stand the way things are at the moment. I do really love him.

He says he will NOT do a long distance relationship. He says why don't I just go for a few weeks. And after that he would forbid me from travelling again for any length of time because if he has a girlfriend he wants to be close to her. He says if I love him I wont go. If I love him I wont leave him.

I want to go. But I feel so guilty. Any advice is appreciated.",1088,Q3,1,I feel stuck in London with my life and background. I want to go on a painting course in Spain. Boyfriend is alone and lost and penniless. Am I being selfish?,37,1,"The poster has been in a tumultuous relationship for 3 years, where her boyfriend has been controlling and abusive. She wants to pursue her passion for art and travel, but her boyfriend is trying to guilt trip her into staying. She seeks advice on how to handle the situation.""",56,1,1,1,1,0
7p60tc,"Hello Reddit, so after dating for a month and a half of being in a relationship I've decided I want to break up with my girlfriend. Note that she is my first girlfriend since I've started getting into the dating scene and she had only one horrible boyfriend which she didn't like.

I've sat down and made a likes and dislikes to really put down into words what I liked in her and disliked about her.

She's really friendly, loyal, can be considerate, has a nice desire for sexual/intimate stuff (we didn't have sex, I held off on it for mine and her sake. Cause of the chemistry of what sex does to women and all), has a sense of humor, can be communicative, and overall a very good personality.

What I didn't like about her is how she's immature at times, dependent, doesn't know what she wants to do in life; kind of existing and enduring college, and I find her somewhat physically attractive.

At some point before actually dating I thought personality is something that's the most important. After dating her, I found out it was really something important to have in a partner. I'd love to find someone with just as great or better personality like hers. But physical attractiveness was more important than I thought. I was really shocked. Despite getting heated sometimes, I don't get that much turned on. I've come to the conclusion that I should just be friends with her (if she permits and is okay with it) and continue trying to find someone else. We're in a pretty happy relationship right now though. According to her, I'm a really good boyfriend and I can say the same of her. Even though it's hard to do, I think I need to move on. That's my case.

I know how I plan to do it but how do I talk about it?? (Obviously I won't read off my list of likes and dislikes)

On to the break up, in a few days I'm planning to invite her to starbucks and share a coffee with her. I'll have written a letter to give to her. The letter is to repeat what I wanted to say for later so that she can read in case she has any misunderstandings or if I don't communicate it well.

I don't know how to word my reasons to break up though. Obviously I don't want to say the reason is because of her physical appearance. Should I say I only see her as a friend but nothing greater than that? Whatever the reason is, I plan to include how great of a girlfriend she has been to me and how it's not her fault for the break up because it really isn't.

Hopefully she'll take it okay! Anyways that's my situation. Any advice or feedback would be awesome!",564,Q3,1,"My considerate cute (first) girlfriend has a great personality but is immature and lacking in physical appeal which is surprisingly important to me. Is this reason enough to break up with her? 
Secondly, if I do go with the breakup I plan to meet up with her, talk to her, give her a letter, and hopefully be friends. How do I communicate it well and how should I word my *reason* for breaking up?",89,1,"The person is seeking advice on how to break up with their girlfriend after dating for a month and a half. They have listed the likes and dislikes about their girlfriend and are planning to give her a letter explaining their reasons for breaking up. They are unsure how to word the reasons and are hoping she will take it okay.""",64,1,0,0,0,0
7nya6p,"Names have been changed.

I met Sebastian [27M] in January 2017 and we dated briefly. I ended up breaking it off with him because he was being pushy about committing and about not using condoms. I had just recently left a very abusive marriage and wasn't ready for a serious relationship nor did I appreciate having my boundaries pushed. Shortly after that, he became involved with Brianna [32 F]. I observed their relationship from a distance via Instagram. They seemed happy and I didn't think much of it.

In September, Sebastian contacted me again. We caught up briefly and then he asked me to join him for some champagne in a hot tub. My first question was, ""Don't you have a girlfriend?"" to which he replied that they had broken up. We met for drinks and he gave a heartfelt apology for having pressured me. Slowly, we began seeing more of each other and the relationship turned physical.

We both live in the Pacific Northwest, but he's going to be moving to his hometown in the southeast at the end of this month. I'm moving to the southwest next month. I knew our relationship had an expiration date, even though he'd sometimes mention wanting to move to the city I'm going to, or have me move to his hometown. In our last encounter, he started pressuring me again to let him take the condom off. Again, I declined but recognized the red flag. 

The final straw was two weeks ago. He was supposed to come over but didn't. No call, no text, no response to my messages. For a week. I was hurt and confused. I gave him the benefit of the doubt and even considered that maybe something had happened to him, so I decided to google him. 

That's when I found their page on The Knot. They're planning on getting married this fall. A little more research lead me to a Facebook post from her sister that they had gotten engaged in October, when Sebastian was still actively pursuing me (we became physical in November). Brianna lives in his hometown- he was there seeing her during the week he had ghosted me. I imagine part of the reason he wasn't responsive to my messages was because he had blocked me while he was with her. When I confronted him about his behavior, he said that I was trying to keep him from his family, which really set me off.

We were going to have a face-to-face conversation during which time I was going to bring up the engagement to gauge his reaction but I broke it off with before we met, saying simply that it wasn't healthy for me to continue to see him. He doesn't know that I know he's engaged and I don't intend for him to find out.

My dad cheated on my mom and that was effectively the end of their marriage. I would never knowingly sleep with someone who was in a relationship, and I imagine he knows that which is why he kept it from me. I feel disgusted and betrayed, but more than anything, I'm very angry for his fiancee. I'm absolutely going to tell her, I'm just not sure how. Whether she chooses to go through with the wedding is her choice, I'm not trying to force her hand into leaving him, but I think she deserves to know what happened so she can make an informed decision. I want to wait until the end of this month once he returns home in order to protect myself from any possible retaliation. None of us in this situation are on social media but I paid $3 for her contact info on Spokeo. Should I call her? Email her? She lives in his hometown, so an in-person meeting is not possible, nor do I think it would be wise. Should I do it anonymously? Should I provide screen shots of our conversations right off the bat, or wait and see if she requests it? I feel like I may only have one shot to do this and want to make sure I do it right.",806,Q3,1,Broke things off with my FWB after he stood me up and ignored me. Learned that he was engaged the whole time. I'm going to tell his fiancee but not quite sure how.,40,1,"The poster dated Sebastian briefly, broke it off due to his pushiness and lack of boundaries, then rekindled the relationship only to find out he was engaged to someone else. They plan to tell the fiancee, but are unsure of the best approach.""",52,1,1,1,1,0
