post_id,Post_text,Post_text_tokens_size,Assigned_Bucket,Post_Text_Zs_clf,TLDR,TLDR_tokens_size,TLDR_Zs_clf,AI_Summary,AI_Summary_tokens_size,AI_Summary_Zs_clf,Post_Text_Human_Inspired_Zs_clf,TLDR_Human_Inspired_Zs_clf,AI_Summary_Human_Inspired_Zs_clf,True_label
7s7iw5,"Last weekend my girlfriend and I got to discussing our future together and one of the topics that came up was the last name of the kids. 

In our culture, the wife is not expected to take the husband's last name but the children would be expected to have their father's last name. However, my girlfriend has proposed that at least one of our future children take on her last name. Now, I understand that we are not restricted, by any means, to what our culture dictates, but still feel uneasy about this situation.

A few points that came up in our discussion:

1. I brought up that she has her father's last name, she claimed she was an only child, and if we only plan on having one child, he or she can have my last name.

2. I claimed that it would be detrimental to our future children to grow up with different last names since that has the connotation of coming from other parents (as the result of divorce & remarriage). She responds ""then all of them can have my last name.""

3. Since we are both the only child, we both feel an equal responsibility to carry on our family lines, regardless of our own gender. 

What do you guys think would be an equitable solution to this problem?",256,Q1,1,"Girlfriend wants future children to have her last name, but I am not comfortable with that due to social conditioning and/or the backlash I would face from my own parents.",34,1,"A couple is discussing the last name of their future children. The wife wants at least one child to have her last name, but the husband feels uneasy about it. They are considering different options and seeking an equitable solution.""",44,0,0,0,0,0
7ntorj,"Hi, I'm 14F and because of health issues I missed a lot of school and eventually started homeschooling this year I didn't have any friends at public schools and I just sit in the house all day now.


I can't join a sports team because of formerly mentioned health issues and I live in a town where a car is a necessity so it's not like I can walk anywhere but I'd like to make friends or just get out of my house for the first time in months and socialize face to face any ideas as to what I can do.",114,Q1,1,I'm homeschooled lonely and can't join a sports team how do I make friends.,19,1,"A 14-year-old girl with health issues has been homeschooled and feels isolated. She is looking for ideas to make friends and socialize face to face since she can't join a sports team and lives in a town where a car is necessary.""",51,1,1,1,1,1
7sj1ut,"My landlord has recently paired me up with a new roommate, we'll call him Matt. For the most part Matt is pretty cool. He respects my stuff, friendly, and helps keep the house clean. 

The only issue that I have is that he SMELLS TERRIBLE!! Like, I never knew a person could smell this bad. I can hardly step into his room because that is where it is most concentrated.

I love keeping a clean and nice smelling apartment. I don't mind doing extra cleaning and buying extra air fresheners to keep it that way. However, Matt's BO literally follows him around and lingers where ever he goes. This has cause our ENTIRE apartment to smell of testosterone and mildew in a matter of days and it's only getting worse. I am seriously worried about having guests over.

Matt also has ADD and is pretty socially awkward. I think he feels especially vulnerable now since he's in a new town, a new college, and a new home so I seriously don't want to hurt his self-esteem even more. How can I fix this issue without hurting Matt's feelings??",226,Q1,1,New roommate has serious BO and it's stinking up our entire apartment. How do I effectively fix this issue without hurting his feelings??,27,1,"The poster's new roommate, Matt, is generally cool but has a terrible smell that is affecting the entire apartment. The poster is worried about hurting Matt's feelings due to his social awkwardness and ADD, and is seeking advice on how to address the issue without hurting him.""",55,1,0,0,0,0
7o14jt,"On New Years' Eve (literally a few days ago), I was hanging with my girlfriend, I was caught with less than a gram of weed by the police (in NJ) and arrested. This is my first legal trouble minus a speeding ticket.

Of course, since I'm still a senior in high school and have no stable source of income besides whatever days my parents ask me to come into their store (usually 5 minutes prior to when they need me), I told them since this will require a lawyer.

My mom cried for a bit (as did my father when he heard a family friend refer to me as ""a good kid""), and my father instantly called me an ""asshole,"" and ""druggie,"" and told me he'd rather hear that I stole shit instead of caught with drugs. They're treating me like a hardened criminal for barely having a joint.

Now they're threatening to force me to stay home for college (which would be an hour-ish away) and won't let me see my girlfriend, who they think is a bad influence, among not let me out of the house to hangout with my friends, even the non-drug using ones. ""Indefinitely grounded"" according to my father.

How do I proceed with this situation?",258,Q1,1,"Parents basically fucking hate me and have called me all sorts of terrible things because I was arrested for small weed possession, and are threatening to demolish my social life. What do I do to improve the situation?",42,1,"The person got arrested for having less than a gram of weed, and their parents are reacting harshly, threatening to keep them home for college and not letting them see their girlfriend or friends. They are seeking advice on how to proceed with the situation.""",50,1,1,1,1,1
7p32fq,"My girlfriend and I live together. I plan on asking her to marry me in the Spring. She and I have both been married before. My divorce is final and hers is in process. She has always told me that she had nothing to hide and that I was welcome to pick her phone up and read anything I want at any time, as we have both been cheated on before.

 The other night, she spent quite a while on her phone in the middle of the night. This is not unusual for her as she has terrible trouble sleeping. I was curious as to who she was talking to for so long, so I looked at her phone yesterday. She had been chatting with her soon-to be-ex husband, having a heart to heart about why they broke up and how much he still cared for her, etc.


Should I be jealous or worried that she had this long conversation with her ex and did not tell me about it? I would never think of having a talk like that with my ex and not telling my GF. It seems to be lying by omission in a relationship where we agreed there would be no secrets.

Should I confront her? Suggestions on how to broach this?",238,Q1,1,My girlfriend spent long time talking to her Ex some nights ago without telling me,15,1,"A man is planning to propose to his girlfriend, who is in the process of divorcing her soon-to-be-ex husband. He found out that she had a long conversation with her ex without telling him and is wondering if he should be worried or confront her about it.""",54,1,1,1,1,0
7rjx2u,"My brother and I usually get along but for some reason, he makes me really angry, to the point that I don't like who I become.

I'm a pretty level-headed guy and never really yell or get angry at anyone but for some reason when it comes to my brother the anger I get is so overwhelming. He's the only one that can get me to that point of anger where I start sweating and shaking.

He's never ""hurt"" me in a major way before and all the things that annoy me are little things like ignoring me, not responding to me when I talk to his lack of eye-contact and him generally ignoring/disregarding my attempts of communication.

I don't wanna be like this towards him and I don't really know what to do. I honestly don't even know what I'm doing posting this here, I feel like this more belongs to /r/offmychest but any advice would be cool.

I love the guy and I'd want us to be cool and friendly when we get older especially since our parents aren't getting any younger.",217,Q1,1,"My little brother does little annoying things like ignoring me, annoying me, and constantly looking at his phone and bearly making any eye contact. For some reason it makes me go irrationally ballistic.",40,1,"The person is expressing how their brother's behavior makes them uncharacteristically angry, to the point of physical reactions. They want to improve their relationship with their brother but feel unsure about how to address the issue.""",42,1,1,1,1,1
7p6wfz,"Hey everyone.


My boyfriend of 1.5 years broke up with me this last Sunday, due to stress revolving his health. He explained he can't seem to feel comfort in this relationship, because he is so worried about himself and me. I have my own plethora of mental health problems, so it's understandable.


I am very hurt, because it was sudden, but I seem pretty relieved as well. Due to stress, we're both super snippy at each other and started to not enjoy each others times. We both agreed its best we break up and focus on ourselves.


My heart still hurts for him. Everything reminds me of him, and I'm having dreams of him almost every night. I wish we didn't break up, but I understand why we did.


We are 100% no contact, and have decided we won't talk to each other for at least a few months, or until we're ready to talk and maybe try to be friends. He says he still cares deeply for me and loves me, but this is for the best.


I wish it was easier to get over, but it isn't. What advice do y'all have?


Thanks!",237,Q1,1,"Got dumped due to stress with mental/physical health problems, went no contact but it still hurts a ton. What do?",25,1,"The poster's boyfriend broke up with them due to stress related to his health. Both agreed it's best to focus on themselves. The poster is hurt but also relieved. They are struggling to get over the breakup and are seeking advice.""",47,1,1,1,1,0
7q5gw6,"I have had two or three or more reoccurring dreams of me cheating on my boyfriend.. and they are so real that I actually feel awful when I wake up or like it actually happened. I've been spooked when I've woken up because it's actually felt like he left and it happened.. can someone shed some light on what this means? my boyfriend is 18 and I am 19 I am female he is male. we have been in a relationship for around 6/7 months.

Recently me and my boyfriend had been going through a tough stage and I've been carrying a huge amount of guilt and I've been feeling like I'm not a good person at all... I've felt absolutely terrible, could this be the reason why? I've felt so down recently and lost too. I feel like I'm going to lose him any second now.. its so terrifying.",181,Q1,1,"Need advice on the dreams ive been having about cheating on the love of my life, they have been strange..",22,1,"The poster is experiencing reoccurring dreams of cheating on their boyfriend and feeling guilty about it. They are going through a tough stage in their relationship and feeling like they are not a good person. They are worried about losing their boyfriend and feeling terrified.""",50,1,1,0,1,1
7nrptd,"My girlfriend has been under major strain since last year when took a new job, she has been depressed and has mood swings for half a year now. 

She has always been inverted and melancholy, but I feel that the new pressure has pushed it to the verge of disaster. I tried to talk to her, but she responded negatively and she had not done anything to help.

In recent months she has said that I am depressed and need help. She told me that I had a symptom or another when she was actually symptomatic. I thought I was crazy, but after I talked about my family, colleagues and a healthcare professional who knows me personally, I could say that I did not have such symptoms. I feel like I have tried everything and I stuck as to what to do...

What can I do to get my girlfriend to do something about her depression?

*Sorry for any errors English is my second language.",184,Q1,1,"Girlfriend is depressed, is saying I am the one who is depressed.",15,1,"The poster's girlfriend has been struggling with depression and mood swings for the past six months, and despite the poster's attempts to talk to her, she has not taken any steps to get help. The poster is now seeking advice on how to encourage their girlfriend to address her depression.""",56,1,1,1,1,0
7u67uj,"My mother was a single mom and she's always raised me and my sister to do everything for ourselves so no one could ever say that they've done anything for us or take anything back. That's how I was raised and that's still the path that I follow. I enjoy doing things for myself. I don't want the jewelry he tries to give me, I don't want him to pay for my meals, I don't want him to buy me anything. It's not being ungrateful or anything, it's just that I am more comfortable with knowing that I bought it myself and it can't be taken away from me.

I've already established this in the beginning of our relationship, that I am a very independent person and I don't need him for anything. I didn't say it in a harsh tone or anything it was more of a ""don't worry about me, I can take care of myself"" way.

He's upset about this when he should be happy. He doesn't have to spend a load of money on things I like! He can use it to spend on himself. I don't understand why he feels that just because we're in a relationship that he has to ""spoil"" me. I enjoy being spoiled but only when I'm the one spoiling myself, haha.",266,Q1,1,My boyfriend doesn't like that I don't want him to do anything for me,16,0,"The author was raised by a single mom to be independent and self-sufficient, and they prefer to buy things for themselves rather than have their partner spoil them. They have communicated this to their partner, but the partner is upset about it.""",48,0,0,0,0,1
95qk2d,"I (30F) married my husband (31M) about 6 months ago after dating for 2 years and knowing each other for about 14. When we first hooked up, I had a very successful career in the adult industry and I supported him for almost 2 years before he got a job. He knew what I did before we hooked up because I had been in the industry for years and everyone back home knew. He told me multiple times that he accepted it and he loved me regardless. However, He has been very abusive, always blaming it on my job before and now that I have retired since our marriage he uses my past against me during every fight. He is physically abusive; it’s happened multiple times but the worst was the morning of our wedding. Before we got married, he destroyed all of the thing in my house on two different occasions. I should add that I only decided to retire and marry him after he secured a legitimate, stable job and once I found out I was pregnant. We lost the baby and I feel resentful to him because I think his physical abuse was a direct cause.


 I guess my question is, what is wrong with me? Why do I think I love someone who can be so terribly cruel to me? Also, why do I want to make this work? When he is in a loving mood, he is wonderful, but as soon as I do something that sets him off, he starts hurling insults and accusations. He looks at everything I do with suspicion; I had to justify driving to the gas station to buy lemon juice yesterday because he was convinced I had left the house to cheat on him. Anytime I try and defend or explain myself, he tells me that I’m yelling at him and I have no self control. I feel as if me, the person I am with my feelings and emotions, is completely disregarded as soon as he calls me crazy. I am at a loss as to what to do. I love him and I want the life he is providing for me, I want a family and I want to be normal and leave my past behind me, I want our marriage to work. Any advice would be appreciated.",443,Q2,1,I feel guilty about my past so I tolerate abuse in my marriage,13,1,"A woman is in an abusive relationship with her husband, who has been physically and emotionally abusive. She feels conflicted about her feelings for him and wants advice on what to do.""",36,1,1,1,1,1
73e584,"Hey r/assistance, I am u/Enlightenedbutterfly and I need your help.

Ever since I can remember I have been an aspiring fashion designer – making clothes for my dolls out of tube socks when I had no other outlet and trying to use any fabric I could get my hands on to make anything I could when I found the gumption to. I love design.

In 2014 I taught myself how to crochet and the medium just speaks to me. Crochet design is officially my niche – I dabble with other methods but the hook and yarn are the most fulfilling. Over the past few years I've been able to build up my portfolio by doing trades and utilizing thrifted yarn and now I am confident that this is something I could do great things with given the chance.

Okay – that's great and all, but why am I asking for help?

My partner and I live with our dog and our cat in a 20' pull behind camper trailer and are barely pulling in enough income to cover our living expenses to boot. I mean, we get by, but there's never any room in our budget for extra.

Some people would go out an get a business loan for their start up. If I had the money to make payments on a loan every month I would instead save that money every month for a few years to bypass needing a loan. However – I don't have that money.

My solution has been to launch the Help Enlightened Butterfly Soar GoFundMe campaign. And in the spirit of giving – 50% of the proceeds are going to be used to make and distribute hats and scarves to charities in my area and an organization called Warmth for All next winter.

Again – that's great and all, but what am I asking for here?

Monetary campaign contributions would be grand, however that is not why I came to r/assistance hat in hand today.

What I need is help getting the word out. I need you to share my campaign on Facebook, Twitter, Instagram, Pintrest, Tumblr and whatever other social media outlet you may use. Because the only way I can be successful at what I'm doing is to spread the message as far and wide as possible.",452,Q2,1,"I'm broke and live in a camper so I started a GoFundMe campaign because I need help to properly start up my business and I need you to share my campaign with all of your social networks.

www.gofundme.com/help-enlightened-butterfly-soar/",57,1,"u/Enlightenedbutterfly is an aspiring fashion designer who has launched a GoFundMe campaign to support her crochet design business. She is asking for help to spread the word about her campaign on social media, and 50% of the proceeds will go towards making and distributing hats and scarves to charities.""",64,0,0,1,0,0
7s1xus,"We haven't been dating very long, only a few months, but it seems like we always get into arguments about her group of friends. She's always with them and when she's not with them she's talking about them, night and day, always finding a way to bring them up. We could be watching a movie or eating lunch and she'll randomly bring up something one of her friends did today or something they said and she gets really pissed off when I don't act interested in the conversation.





We're sort of long distance, she goes to College in another city a few hours away so I don't see her all that much anymore yet she's made the time to go out of town with her friends THREE times this month and has only seen me once. I understand that she's close with her friends, and I respect that, but it'd be nice for once if I could go a day without hearing about them or what they did or what they said because I don't really know them all that well and they're always rude to me, so I genuinely don't really care about them. As mentioned above, my girlfriends gets pissed off when I act uninterested in her friends and starts accusing me of hating them, which is ridiculous because I hardly even know them, and she gets really upset and stops talking to me for awhile. I'm starting to think that it's gonna end up being a choice between me or her friends and so far, I'm losing.",298,Q2,1,"My girlfriend's friends are annoying as fuck and I'm not very fond of them. I don't ever say anything negative about them, yet my girlfriend still gets pissed off if I don't praise them. All our arguments are about them.",48,1,"The person is frustrated because their girlfriend is constantly talking about and spending time with her friends, to the point where it's causing arguments in their relationship. They feel like they are losing out to her friends and are considering it may come down to a choice between them or her friends.""",56,1,1,1,1,1
7ovisa,"So my girlfriend and I were really happy together, we wad 6 years of almost perfect relationship and we live together for 5 years. We often said to each other that we were ""the one"" (that's probably something every couple says, but I mean we were really in love and we had not much arguments). 
Last summer she went through some difficult moments because of college and she was very disappointed by two of her friends (or though they were)... And then, at the end of the summer, she began to be more distant and we began to argue more. So one day I just asked what was happening to her and she told me that she didn't know anymore if she loves me. She further explained that she does feel something for me, but she's not sure anymore if it's love...


It was two months ago and since then, we've been both trying to make some efforts to make our relationship great again (sorry for the reference, but I confess the phrase is catchy), but she's still not sure and is still often distant... Sometimes she says I love You, and sometimes she's not sure again...


I don't really know what it means to not know what one feels for another. I guess it's a thing, and I try to accept that, but I don't know how to react, what to do, what to think... I was so happy with her, I just feel overwhelmingly sad and can't help ask myself what a did wrong, what I should do, where this is going. The last time we talked about it, she said was too stressed because of her masters graduation to really think about us right now and said the situation probably won't resolve until she finishes it in may... 

but that's a long time to suffer....

Do you have any advice ? Or anything to say really... I just feel alone in this...",380,Q2,1,She always said I was the one. After six years she doesn't know if she sill loves me...,21,1,"A person is seeking advice after their girlfriend expressed doubts about her feelings for them. They have been trying to work on the relationship, but the girlfriend is still unsure and distant. The girlfriend attributes her uncertainty to stress from her masters graduation, and the person feels alone and unsure about what to do.""",59,1,1,1,1,1
7rk4mp,"After speaking with a man daily for over a month, having already met him in person and having such amazing chemistry we knew we would see each other again. 

My company was having a corporate event for employees only but providing a hotel room as it was out of town. I invited him to hang out in my hotel room just so we could talk and get to know each other, but we're both adults, so whatever happens - happens!

From the time we planned this meet up he was so excited, said he couldn't stop thinking about me, couldn't wait to see me and so on. I bought lingerie, just in case. He said he couldn't wait to rip it off me.

The day came and I checked in and sent him a pic of my room. Suddenly, he tells me he won't have a lot of time, still coming though.

He arrives shortly after 8pm and we start talking on the couch. We kiss a little but the couch was uncomfortable (he's a big guy.) I told him we'd be more comfortable on the bed. We make out on the bed. He was on top of me with his hand up my unzipped skirt.

All of a sudden, he gets up and says he has to go but acts as if he really doesn't want to leave. I pull out the lingerie and tell him it's too bad he's not going to see me in it. He seemed really disappointed that he 'had to go.'

He texted me when he got home to thank me for a great visit. I texted him the next day and he never responded and I never heard from him again.

Anything similar ever happen to anyone else?
What do you think happened?",348,Q2,1,"Ghosted after over a month of talking to a guy. Met in hotel room. Made out but didn't have sex. If he didn't want to cheat or chickened out at the last minute why would he carry on so long with me? He already crossed that line by visiting my hotel room and making out with me. Also, he did not seem to be “aroused” at all even though he seemed to really enjoy his time with me. We still are connected on Social Media and he still likes most of my selfies. Even though I've already moved on just wondering what it could be.",122,1,"The person had a promising meet-up with someone they had chemistry with, but the other person abruptly left after some intimate moments and never responded to further communication.""",31,1,1,1,1,0
