post_id,Post_text,Post_text_tokens_size,Assigned_Bucket,Post_Text_Zs_clf,TLDR,TLDR_tokens_size,TLDR_Zs_clf,AI_Summary,AI_Summary_tokens_size,AI_Summary_Zs_clf,Post_Text_Human_Inspired_Zs_clf,TLDR_Human_Inspired_Zs_clf,AI_Summary_Human_Inspired_Zs_clf,True_label
7nhkfr,"Throwaway because she reddits. Also, sorry for my mistakes, English is not my first language.

So, I fucked up. Like, REALLY fucked up.

Basically, I’ve been together with my current girlfriend for 7 months or so now. We are both very stubborn so fights are normal for us - most of the time they’re nothing serious and we make up immediately after. We also jokingly insult each other’s all the time, no big deal.

Yesterday night we started bickering like usual, over something incredibly stupid but whatever, our “fight” was light-hearted and we didn’t mean no harm. The problem was - I had a very, VERY shitty day so I was feeling extremely annoyed and nervous. I know this isn’t an excuse, but bear with me. So things started to escalate & I ended up saying some very mean things to her. Like, “picking on your insecurities” level of mean. I’m not proud of it, at all.

I regretted my words immediately after I shouted them. She immediately closed her mouth and just stared at me with disbelief and hurt in her eyes like she couldn’t believe I just said that. I could not believe it, either. But like I said, I’m a fucking stubborn piece of shit so I didn’t even tried to apologize. We stared at each other’s in an awkward silence for a while, then she just said “I need to go to the bathroom” and she left me to think about what I had just done and drown in shame.
Anyway, 5, 10, 15 minutes pass, no sign of life by her and I’m feeling more and more regretful every second that passes. I decide to go to check on her, but the door of the bathroom is locked. I put my ear against it and I hear her sobbing.

I felt so bad I almost started crying right there. My girlfriend is very emotional but rarely lets herself cry in front of others, she always bottles everything up and then lets go when she’s alone. I can’t believe I seriously made her cry, I felt (and still feel) horribly guilty. I love her very much. So I knocked and told her to please let me in. She refused, I told her I was sorry and I didn’t mean any of the things I said and that I love her very much. She said to go away so I did (we were at her house).

Now a whole day passed and she still refuses to talk to me :( I’m worried, guilty and just want to hug her and tell her again that I’m sorry. I sent her some messages but she ignored them. I know I fucked up and she has every right to be mad at me since I said some really bad things but I feel so bad. I just want to reassure her that I didn’t mean any of it. I feel like an asshole who just kicked a puppy. She didn’t deserve any of the things I said and did.

What should I do? Should I give her some more space and let her come to me? Should I apologize again? I love her a lot and I don’t wanna lose her over a stupid fight in which I couldn’t keep my stupid mouth shut.

*",661,Q3,1,"* said some pretty hurtful things to my GF of 7 months while we were fighting, I made her cry and now she won’t talk to me. I feel very bad and guilty, I already apologized and I don’t know what to do,",51,1,"The person admits to having a bad day and saying very mean things to their girlfriend during a fight. The girlfriend is now ignoring them and they feel guilty and want to apologize, but they're not sure if they should give her space or keep trying to reach out.""",53,1,1,1,1,1
7pqqrs,"Been together for 5 years, married for 1 year. My husband outwardly reserved/introverted but he's also very goofy around me. We joke around and are playful with each other in most interactions unless it comes to serious subjects. Lots of teasing, tickling, and 'play wrestling' in our home. 

The problem has always been when it comes to, umm, being romantic. We struggle in that category. I am very romantic by nature, so I send flirty texts, touch him, tell him what I want him to do to me, etc. Although I have no problem turning him on, the problem is when it comes to reciprocating. He deflects pretty much all my attempts to be sexy with him in some way or another. Flirty text? Respond with something comical. Sexy touching? He'll make sound effects when he grabs me certain places. Dirty talking in bed? Respond with something silly and not sexy. 

It makes me feel bad, like I'm not able to get through to him that I'm trying to share my desire for him and I'm vulnerable. It also kinda kills my buzz so to speak. I feel like I am always the one seducing and I just have a hard time getting turned on when I feel like he doesn't makes any attempt. He told me early on in our relationship that to him sex should be something we should be able to laugh at and shouldn't be some super serious thing. I'm not trying to make it 'super serious', I just kind of want to be aroused and it's hard to do that when he's on top of me and waggling his eyebrows like Groucho. 

I know it's hard for him to come out of his shell and be sexy, basically because he lacks the confidence. He finds it awkward and not really him. At the same time, I want him to take charge and try to actually turn me on without joking for once. I've never been able to cum with him in the entire duration of our relationship and I just feel like this might be a part of the problem; that I don't feel very romanced. 

I had this talk with him before and it didn't really change anything. Now lately I decided that I am going to stick to it, that if he doesn't take it seriously while we're getting 'amped up' for sex that I will just tell him that I'm suddenly not in the mood and tell him that he's being too goofy right now. Basically condition him against the bad habit.

Any other ideas? How do I communicate with him the way I want him to romance me if it's against his nature? Is it even possible? Should I just try to change myself? It's been five years and I'm still having this problem, what do I do?",576,Q3,1,"Husband keeps killing the mood by trying to be silly whenever we're trying to get intimate. Also deflects my attempts at flirting. How do I communicate with him the way I want him to romance me if it's against his nature? Is it even possible? Should I just try to change myself? It's been five years and I'm still having this problem, what do I do?",79,1,"The poster has been with their husband for 5 years, but struggles with the lack of romance and seriousness in their intimate moments. While the husband is goofy and playful in most interactions, he deflects any attempts at being romantic or sexy. The poster feels that they are always the one seducing and wants their husband to take charge and be more serious in intimate moments. They have tried talking to him about it before, but it hasn't changed anything. They are considering conditioning him against his 'goofy' behavior, but are also seeking other ideas on how to communicate their needs for romance and intimacy.""",122,1,1,1,1,0
81asft,"Where do I start, I'm stuck living with my parents for the time being, my dad being a narcissist.
He's of course not diagnosed though, cause he wouldn't ever visit a doctor because nothing's wrong with him, right? And then, prove it.


My dad has always been abusive to me and everyone else in the family. Physically, emotionally, mentally, pretty much every way imagineable. 
I have even been brought right next to the point of death at his hand when I was too young to physically defend myself.
I was on the bed, and I forget for what reason specifically, but I believe I dared to question his ultimate authority on some matter.
In an act of his so called discipline, he bent my legs backwards over my head and pushed me against the wall, hitting me as hard as he could, I remember that I couldn't even speak, simply motioning for help from my mom who happened to be in the hallway at the time.
If my mom had not intervened, I would likely have been choked to death as I was only about 10-12 at the time, being assaulted by this 50 y/old ""man"".

There have also been other been other accounts of assault one in which I was shoved into a mirror by him, another pushed into a wall.
I have taken up learning at least some basic self defense measures as a result of this, and constantly think when in a room with him what I could weaponize in the case of an attack. 

He has purposely targeted mainly my mom over the years, through abuse ranging from emotional to physical.
Often he will get in her face, or mine now, screaming derogatory insults for the sole intent of trying to get one of us to hit him, just so he can claim ""assault"" then thinking he has the upper hand and can force us into submission with the threat of jail over our heads.

I would always intervene on my mom's behalf and defend her with my life.
I have even gone so far as to document on camera incidents of assault which I keep under lock and key.

Many times I have urged my mom to file divorce, even offering myself to speak in her behalf as I have witnessed all the evils of this ""marriage"" that only serves as a servitude to his abuse. 
The main problem has always been that my younger brothers would likely be legally obligated to attend visitation in one form or another with him. 

I have seen what he will do in desperation, tearing phones out of the wall, shoving, pushing. And this is the mild version, I am sure he would stoop to far greater if we were to fall out of his control. 

So we sit trapped to his tyranny.

Lately though, as in the past couple years he has started to target me and my younger brothers..

He singles each of us out engaging in pointless arguments, only looking to make our lives hell.
Then later has the gull to rant how he wants the best for us, while screaming at the top of his lungs in our face after a series of cutting insults.
I'm sick of his derogative sociopathic tendencies. 

The only way you have a day of peace in the house is by not having him in the house.
I can only take so much, and yet there is nowhere I can go to escape this hell I am forced to live through every second of every day.
I have no job yet, or a drivers license because, guess what, the only way I can get a license is to drive alone, in a car with that narcissistic sociopath. For all I know, I'd end up dead on the side of the road. 

We can't afford drivers lessons with a normal human being, and my choosing such would only bring more harassment as in his little world he's the best driver there's ever been or ever will be.
Aaand since I can't really get a job, as I can't drive, I now get harassed about being lazy.

On top of that, I barely have any ability to get any money my own to make any sort of fund to get out of here.
I was never even able to have any hope of a bank account without it being joint to him so he could suck it dry until I reached age 18.

He's always been a loser his entire life, and constantly he has taken money from us kids... any money you get you better keep that info to yourself unless you want it stolen from you with a shallow promise of it being paid back someday.

Only when that someday comes that he has more than a bounty from child tax money he's scraped up, and maybe a couple cents from work, you'll be told something to the effect of ""what did you ever do to deserve it?"", or ""after how you treat me?"" It being the money you gave for god knows what reason. Likely because you are decent human being, one with feelings of sympathy, something's he fails to process. Well how about how you treat us kids? How about that?


No this isn't just some edgy teen, oh I hate my dad, I have every reason to hate him, for what he has done, and continues to purposely do to me and my family.
For nearly killing me, for scarring us all to the point I can't even meet a nice person, or have any friends, and not wonder whether they do or don't treat their family like a lump of sh.

Nobody needs, nor should they ever have to live the life I have been forced to live. Nobody should have to call the police because they don't feel safe within their own home. Nobody should have to walk on eggshells continuously wondering what's going to be the next trigger for a two week argument. Nobody should need to learn self defense for protection against another family member. 
Nobody.

Though it doesn't stop here, oh hell no, that's just the beginning of my newest insanity.
Now, after how I've stood up for my mom through all these years, in every way possible.
She repays me with utter deceit and repeatedly lays me into the hands of my narcissistic nemesis.

Repeating his words of deceit as if they are truth, as if he has changed. He's always been a narcissist, and guess the hell what? He's always going to be one.

Now it's not bad enough I have him harping on me all the time, nope, now I have to have my mom on my back to, supporting his false accusations and claims.

""You have to forgive and forget"". Newsflash, you've been doing that for the past 25 years mom, and where did that get you? Where did that get any of us? He has never given me any or anyone else any reason to be convinced he has / will / nor will ever have any intent to change whatsoever at any point in time. 
Oh, and I should just stay quiet and let him say his thing. Why should I have to?
I need him to tell me that everything I'm doing is wrong, simply just because it doesn't conform to his idea of what I should be doing? AKA kissing his a?

Don't think so.
Sorry to rant on like this. Maybe I am the problem, I don't know, in times like these... it's.. just hard to even know what the truth is anymore....
I just feel trapped, and at my breaking point... perhaps I just need to vent for now...
I'm just so tired of dealing with this nonsense and constantly being made out like I'm the problem just because I'm now an adult, so suddenly I'm to blame for the wreck that my life is.

All this, when nobody trained me in a job, nobody sat down and talked to me about what I'd like to do, and I've never had someone to comfortably express my true feelings to. 

Nobody at this point is even there to support me, and it's a constant uphill battle I can't win with no other way to go. 
At this point, only way I've seen out, I'm not going to sugar-coat it.. is to kill myself.
In the heat of these constant arguments with both my mom and dad now on my case, it's too much stress for me to take. There's only so much a person can handle before they are at their limits. I'm at my wits end at this point.
I'm just too much of a coward to kill myself, and that's one of the few reasons I'm even still around.

What hurts the most is that after all I have done for her, this is how she treats me... 
Favouring him who's done nothing but agonize her, against me. 

That's all I'm going to trouble you people with...
I'm sure you got your own problems without worrying about me...
Thanks...",1812,Q3,1,"My mom is now supporting my narcissistic father after all he's abused her, me, and my brothers, and becoming regularly insistent on the ""fact"" that I'm the problem around here. Also that I'm the wicked ungodly one.",51,1,"The author describes living with an abusive narcissistic father, detailing physical and emotional abuse. They express frustration with their mother for siding with the abuser and feeling trapped in a hopeless situation. They also mention contemplating suicide as a way out of their constant suffering.""",51,1,1,1,1,1
7o2mgv,"I come from an Asian family where kids are not expected to move out, its the opposite where kids are supposed to live at home and take care of the parents when they become adults, however living in America has made me hate this mindset because I am never able to be an individual.


My dad is extremely controlling and a downright bully, he verbally abuses me and my siblings about anything possible just for the sake of abusing us. He always demands we listen to him and do things his way and if we don't we are ""disobedient"" and ""bad children"". He even abuses my mom verbally and she knows it but deals with because its how she was raised, even random strangers like waiters and cashiers at stores are bullied, he'll complain about lines being long and blame cashiers for being ""slow"" ect. OVERALL THIS MAD IS EXTREMELY NEGATIVE and if you try to talk back or explain to him to be a little bit nicer he gets defensive and goes on a tantrum how hes our dad and we have no right to talk to him like that.


My mom has never had a job in her life and my dad had a heart attack 2 years ago and has had other medical problems since then on and off so has not gone back to work and most likely won't (he is nearing 70).

I want to move out but moving out is considered ""disrespectful"" but I can't live at home my entire life, I don't want to bring my girlfriend home with me because he will make her life a living hell too.

I want to move out because staying at home has made my entire family depressed, pretty sure I am becoming suicidal because there are days I think my life would be better if I didn't exist and then there are days I pray he passes away. It's an extremely negative relationship.


The problem with me moving out is I currently help pay some of the bills at home, not a lot at the moment but I'm unsure how much money my parents actually have and if they'll be able to support themselves in the near future (like next 1-2 years) if I'm not at home paying the bills, but if I move out I'll have my own bills to pay and won't have much extra money to help them out. This is the dilemma, do I move out and say fuck my parents for making my life miserable for the past 24 years and care about my own happiness? Do I stay home and hope things get better and maybe he'll pass away soon so I don't have to deal with him for much longer? My mom is what makes this so hard because shes such a good person and nice and amazing and deserves better then to be abused but even she defends him (because she feels she has to for being married to him for 40+ years) she claims hes mean now because of the heart attack but I remember him being rude my entire life.",596,Q3,1,"Dads a bully but financially not stable, worried about my mom but shes on his side, is moving out the right option?",27,1,"The author comes from an Asian family where children are expected to live at home and take care of their parents, but living in America has made them hate this mindset. Their father is extremely controlling and verbally abusive, making life at home unbearable. The author wants to move out for their own happiness, but is conflicted because they currently help pay bills and are unsure if their parents can support themselves. They are also concerned about their mother, who defends their father despite his abusive behavior.""",96,1,1,1,1,1
7szr0t,"Lately I have been feeling progressively worse about my relationship and myself. For the entire duration of our 3 years together it's had a lot of hardships and negativity. I think within these past three months I have realized that I have been unhappy and sick of the lack in change for a long time despite just now noticing my own feelings on the matter. I feel like I don't have the mental energy to stick it out and wait for things to potentially improve anymore. I'm drained, I'm depressed, I've started seeing a therapist and cried to her today about the thought of having to break up with him. It's not something I want to do, but I don't know how much longer I can wait this out. 

We can't communicate, we somehow always end up fighting in a way that tears us both down. I feel like the times that we aren't fighting, he's just depressed and I am trying to make him feel better despite also being depressed. I don't feel like I have time to take care of myself because I try so hard to not only fix us but fix him as well because he won't fix himself. I know I shouldn't be trying to fix him and he should be trying to help himself but that is how things have been. 

I have constantly asked him to go to therapy with me or by himself, he always says he doesn't have time and says he will do it sometime in the future. He is starting a new job next week with better hours and is supposedly going to have more time to try these things then but honestly I don't feel like waiting anymore. I don't want to lose the relationship but I don't want to stay in this specific situation feeling drained and like I've lost myself. I've gotten to the point where all of the waiting has led to the breaking point and I miss feeling happiness. 

On top of this, I'm just beginning to think that maybe we aren't a good match. I could really use additional input on this because I'm not exactly sure what a healthy and compatible relationship looks like at this point. When we try to go out and do things, we often do not have fun because our personalities clash. 

Example of this, I wanted to go kayaking and was surprised that he said yes because he rarely wants to be outside. We get to the springs to kayak and I want to go in the water because I see no point in kayaking if you don't go in the water. He refuses because he hates water. I try to joke around with the paddles and he gets upset I am not taking it seriously. I like to have fun but feel like I cannot be myself and have fun when we do go out. We are very opposite in that way. 

At the moment I don't think I will end things and I will wait for this new job of his to start since it's so soon in the future, but I have made arrangements to move out if I decide I really want to and am still not sure if I actually should. I'm scared that if I tell him I need to move out and have space that things between us will come to an end. I've thoroughly expressed to him that I am unhappy, I feel unsupported, I feel like I can't be myself, feel drained, etc. but he says he is being himself and still trying but it's not enough for me so I should leave. I don't want to just leave, but I don't feel like he's working with me for an alternative so we can be happy and I can be too. Any advice?",731,Q3,1,feeling drained because relationship has seen no improvement in years and I am just now realizing how unhappy I actually am over all of the negativity,27,1,"The poster is feeling unhappy and drained in their relationship of 3 years. They have realized that they are not compatible and have been trying to fix things, but their partner is not making an effort. They are considering breaking up and seeking advice on what to do.""",53,1,1,1,1,0
